{
  "$schema": "http://json-schema.org/draft-07/schema#",
  "title": "m1315HandoutContent.json / m1315HandoutContent-en.json",
  "type": "object",
  "required": [
    "title",
    "subtitle",
    "modalityChecklist",
    "imagePromptTemplate",
    "videoPromptTemplate",
    "musicPromptTemplate",
    "rightsChecklist",
    "deliveryChecklist",
    "reflectionSummary",
    "nextPageHeading",
    "nextPageIntro",
    "primaryCtaLabel",
    "secondaryCtaLabels",
    "websiteUrl",
    "websiteCta",
    "footerText"
  ],
  "additionalProperties": false,
  "properties": {
    "title": { "type": "string", "minLength": 1 },
    "subtitle": { "type": "string", "minLength": 1 },
    "modalityChecklist": {
      "type": "array",
      "minItems": 1,
      "items": { "type": "string", "minLength": 1 }
    },
    "imagePromptTemplate": { "type": "string", "minLength": 1 },
    "videoPromptTemplate": { "type": "string", "minLength": 1 },
    "musicPromptTemplate": { "type": "string", "minLength": 1 },
    "montagePromptTemplate": { "type": "string", "minLength": 1 },
    "rightsChecklist": {
      "type": "array",
      "minItems": 1,
      "items": { "type": "string", "minLength": 1 }
    },
    "deliveryChecklist": {
      "type": "array",
      "minItems": 1,
      "items": { "type": "string", "minLength": 1 }
    },
    "reflectionSummary": { "type": "string", "minLength": 1 },
    "nextPageHeading": { "type": "string", "minLength": 1 },
    "nextPageIntro": { "type": "string", "minLength": 1 },
    "primaryCtaLabel": { "type": "string", "minLength": 1 },
    "secondaryCtaLabels": {
      "type": "object",
      "required": ["decide", "map"],
      "additionalProperties": false,
      "properties": {
        "decide": { "type": "string", "minLength": 1 },
        "map": { "type": "string", "minLength": 1 }
      }
    },
    "websiteUrl": { "type": "string", "format": "uri" },
    "websiteCta": { "type": "string", "minLength": 1 },
    "footerText": { "type": "string", "minLength": 1 }
  }
}
