{
  "title": "Turinio kelio atmintinė",
  "subtitle": "Problema → promptas → DI įrankis. Įklijuok ir dirbk.",
  "modalityChecklist": [
    "Vaizdas – įklijuok promptą į vaizdų įrankį (Midjourney, ChatGPT ar pan.).",
    "Video – raktinį kadrą paversk 3–5 s klipu video įrankyje.",
    "Garsas – balsas arba fonas garso įrankyje; viena eilutė apie teises.",
    "Montažas – sudėk dalis montažo įrankyje (CapCut ar pan.)."
  ],
  "imagePromptTemplate": "Brief: tikslas [Awareness / Engagement / Conversion], auditorija [kam], platforma [kur bus naudojama].\nSukurk hero vaizdą: [OBJEKTAS ir veiksmas], aplinka [KONTEKSTAS], stilius [STILIUS], proporcijos [1:1 / 16:9 / 9:16].\nBrand: spalvos [X], tonas [profesionalus / draugiškas / premium]. Be teksto vaizde, jei jo nereikia.\nStiliaus užraktas (nekaitaliok): [15+ žodžių]. Modelis šiai serijai: [vienas].\nTeisės: patikrink, ar įrankis leidžia viešą naudojimą.",
  "videoPromptTemplate": "Pradžia: raktinis kadras. Kas nekinta: [produktas / etiketė / spalvos]. Objektas daro: [vienas veiksmažodis]. Kamera: [vienas judesys]. 3 s pirma. Paskutinis kadras: etiketė skaitoma, nėra naujų objektų.\nTeisės: tas pats kadras, tas pats stilius – nekeisk svetimų ženklų.",
  "musicPromptTemplate": "Rolė: [kam kalba]. Tonas: [šiltas / ramus]. Tempą laikyk tą patį. Žodynėlis: [ženklas] = [kaip tarti]. 3 eilutės: kablukas / nauda / kvietimas. Fonas po balsu, be vokalo. License: commercial.\nTeisės: ar galima naudoti viešai?",
  "montagePromptTemplate": "Montažo planas (15–30 s):\n0–3 s: [kablukas]\n3–8 s: [produktas / nauda]\n8–15 s: [detalė]\nPabaiga: [CTA]\nGarsas: [balsas / fonas] | teisės: [licensed]\nDI žyma: sukurta su [įrankis].",
  "rightsChecklist": [
    "Prie kiekvieno prompto – viena eilutė: ar galima naudoti viešai?"
  ],
  "deliveryChecklist": [
    "Užduoties aprašas: tikslas, kam, kur.",
    "Bent vienas promptas ir rezultatas arba nuoroda.",
    "Jei jungei visumą – video + garsas + montažas.",
    "Pirmas realus panaudojimas per 24–48 val.",
    "Užraktas vienoje kortelėje: modelis · stiliaus antraštė · pavyzdžiai · balsas · teisės · DI žyma."
  ],
  "reflectionSummary": "Per 24–48 val. panaudok vieną promptą tikrame projekte. Užrašyk: kas pavyko, ką koregavai ir ar teisės aiškios.",
  "nextPageHeading": "Ką daryti per 48 val.",
  "nextPageIntro": "Kelias baigtas tada, kai turi ne tik rezultatą, bet ir promptą, kurį gali įklijuoti dar kartą.",
  "primaryCtaLabel": "Ekosistemos žemėlapis (blog)",
  "secondaryCtaLabels": {
    "decide": "Nuspręsk kitą žingsnį (Decide)",
    "map": "Peržiūrėk ekosistemos žemėlapį (Map)"
  },
  "websiteUrl": "https://www.promptanatomy.app/",
  "websiteCta": "Kursas ir daugiau: promptanatomy.app",
  "footerText": "Promptų anatomija – promptų struktūros mokymas. © Kurso medžiaga."
}
